Question,Answer
"1. What is the main focus of the article ""What Do We Mean by GenAI? A Systematic Mapping of The Evolution, Trends, and Techniques Involved in Generative AI"" in relation to content generation through AI?","The main focus of the article is to provide an analysis of AI-driven solutions for content generation to define and delimit the meaning and use cases of Generative AI. The article aims to understand and characterize the landscape of Generative Artificial Intelligence by analyzing 631 solutions published over the last five years. It explores the understanding and application of the term ""Generative AI"" both in the broader public and the AI research community."
2. Who are the authors of the article and what are their affiliations in the context of AI-driven content generation?,"The authors of the article are Francisco José García-Peñalvo and Andrea Vázquez-Ingelmo. They are affiliated with the GRIAL Research Group, Computer Science Department at the Universidad de Salamanca in Spain."
"3. According to the article, what is the significance of Artificial Intelligence (AI) specifically in the context of content generation across various sectors?","The significance of Artificial Intelligence (AI) in the context of content generation across various sectors lies in its ability to produce creative and realistic outputs. AI, particularly generative artificial intelligence (GenAI), has seen significant growth, enabling the creation of human-like content such as texts, images, and music. Tools like ChatGPT, Dall-E, and Midjourney have democratized access to Large Language Models, making content generation more accessible to a wide audience. This has implications for fields like medicine, education, art, music, marketing, and software development, among others, by enhancing processes, augmenting datasets, and improving predictions."
"4. Which specific subset of AI has seen significant growth, particularly in late 2022, as highlighted in the article's discussion on content generation?","The specific subset of AI that has seen significant growth, particularly in late 2022, as highlighted in the article's discussion on content generation is Generative Artificial Intelligence (GenAI)."
"5. How have tools like ChatGPT, Dall-E, and Midjourney democratized access to Large Language Models (LLMs) for content generation, as discussed in the article within the realm of AI-driven content generation?","Tools like ChatGPT, Dall-E, and Midjourney have democratized access to Large Language Models (LLMs) for content generation by enabling wide audiences to effortlessly engage in the creation of human-like texts, realistic images, and even music. These tools have made it easier for end-users to access and utilize LLMs, which were previously limited to researchers and experts in the field of artificial intelligence. This democratization has allowed a broader range of individuals to create high-quality, human-like content without requiring specialized knowledge or technical expertise in AI."
"6. Why does the concept of ""Generative Artificial Intelligence"" lack a universally accepted definition, as explored in the article's analysis of content generation through AI?","The concept of ""Generative Artificial Intelligence"" lacks a universally accepted definition because different stakeholders, such as the general public and the AI research community, interpret and apply the term differently. The broader public often sees ""Generative AI"" as the AI-driven creation of tangible content, while the AI research community focuses more on the models used in generative applications without explicitly categorizing their work under the term ""Generative AI."" This discrepancy in interpretation and application leads to potential misunderstandings and confusion about what exactly constitutes Generative AI."
7. What is the main focus of the literature mapping presented in the article in the context of generating new data instances through AI for content creation?,"The main focus of the literature mapping presented in the article is to analyze and define Generative AI, specifically in the context of generating new data instances through AI for content creation. The mapping aims to provide a structured framework to evaluate existing research in the field of Generative AI, identify patterns, and spot potential gaps. It focuses on understanding the landscape of generative AI solutions, the models employed, the types of content generated, and the application domains. The goal is to establish clear definitions and boundaries within the field, reduce ambiguity, and foster a consistent discourse on Generative AI."
"8. What dichotomy in the understanding and application of the term ""Generative AI"" is suggested by the findings in the article regarding content generation through AI?","The findings in the article suggest a dichotomy in the understanding and application of the term ""Generative AI"" between the general public and the AI research community. The general public commonly uses the term to refer to the creation of tangible content through AI-powered tools, such as images, text, code, models, and audio. On the other hand, the AI research community primarily discusses generative applications focusing on the models used, without explicitly categorizing their work under the term ""Generative AI."" This difference in perspective highlights a gap between the broader understanding of Generative AI and the technical nuances discussed within the research community."
"9. How does the broader public interpret ""Generative AI"" compared to how the AI research community discusses it, as mentioned in the article's exploration of content generation through AI?","The broader public commonly interprets ""Generative AI"" as the AI-driven creation of tangible content, such as images, text, code, models, audio, etc. They see it as a tool for producing human-like material. On the other hand, the AI research community primarily discusses generative applications focusing on the models used, without explicitly categorizing their work under the term ""Generative AI."" They emphasize the models employed in generating content rather than explicitly labeling their work as ""Generative AI."""
"10. What applications have set a milestone in the application of artificial intelligence to content generation, as discussed in the article within the scope of AI-driven content generation?","The article discusses various applications that have set milestones in the application of artificial intelligence to content generation. Some of these applications include:

1. Image enhancement: This involves increasing image resolution, completing missing or damaged parts, or colorization of images.
2. Style transfer: A technique that transfers the style of one image onto another.
3. Text-to-image translation: Generating images based on textual descriptions.
4. Procedural content generation in videogame development: Automatically creating game content like levels, characters, or environments.
5. Text generation in natural language processing: Creating human-like text, including text generation, summarization, and translation.

These applications have been significant in advancing the field of AI-driven content generation."
